{
  "schemaVersion": 1,
  "id": "",
  "name": "",
  "version": "0.1.0",
  "kind": "extension",
  "runtime": "python312",
  "entrypoint": "tool.py",
  "provides": {
    "tools": [
      {
        "name": "word_count",
        "description": "Count the words and characters in a piece of text.",
        "inputSchema": {
          "type": "object",
          "properties": {
            "text": {
              "type": "string",
              "description": "The text to count."
            }
          },
          "required": [
            "text"
          ],
          "additionalProperties": false
        },
        "export": "run",
        "classificationProposal": {
          "requiresWrite": false,
          "requiresConfirmation": false
        }
      }
    ],
    "routineDrafts": [],
    "proposedGrants": []
  },
  "resources": {
    "memoryMb": 64,
    "processes": 1
  },
  "egress": "none"
}
